{"artifact_hashes":{"inputs/date_roles.json":"36e5a26e6d0a2e9e2a1bd966a8af9f3e4c2ae8edbede22e580fa8fcdd3acaa7b","inputs/exposure_ledger.json":"6c0780b1349f38e2cada974642310bde8b0568e73fa8902cc766389c6fb65b84","inputs/input_inventory.json":"ab62486ae817ccc109d6c0a0c07359bdde425434725b1717c0bf93cadc2a3030","inputs/truth/adapter_contract.json":"36f3e5af82737e92d288c88e4de329e5d8c372154817eb8e78443b5a2f0720f8","inputs/truth/holdout_evidence_inventory.json":"aadd369759eb389ab5114357e191de640cbe430d0127f99cb96d50bbc69eae98","inputs/truth/trusted_labels.json":"d4691fea78dd1b19535b8146fb3fb314077fca8f51141e6924d9c63968260709"},"code_identity":{"README.md":"5919371eadcd5657cf534bfa3868ac171f319194593ccd4268e6efd9ebb6f591","config/experiment.json":"f68353667f068a2942aa86556475ed4a2db9102138e5f1a2dda2fae59de6fae7","reports/T01_OWNER_RUNBOOK.md":"91343daf78987affd8031fec0686d813d9c237d2e3b4f9eceb5a3383c57a0646","run.py":"dec73a11bdfe31b252bb442bc56b18ee0fa0f34e34c64d18a9f2fdd0d938a248","schemas/date_roles.json":"dff3d0a1845083977d55afd264c1bd6693ad0f74133a1cb22c8d9e1bc1afd208","schemas/experiment.json":"685404be50d04cc37116e4d047c2124402e34746cd745bf07aa5c61ff8b904b0","schemas/exposure.json":"7a01f4ef588cf6e2aae899c623d8b1d001cf722346c498030858667f38785700","schemas/forecast_commit.json":"0b02f42a9a41740656ae9a5994aed5e26196c9372ed3cf0197e63fde83e2df35","schemas/holdout_evidence.json":"d47903926db063ca5a78f462f1439e46452f09ffbceda9077b9e02adaa93c35d","schemas/input_inventory.json":"1a412ae19d81eca0754230348212864d0944d74e5afb8a163e90e887301dc830","schemas/pass.json":"2e4c831a1e4524cc0f4443fe65da923692b918c87d725806160cfede78b1f839","schemas/run_state.json":"81302fd25b23b18a1c3402528cff4d1b07c984c12f9dce1457ac8ccb0ef308cc","schemas/trusted_labels.json":"a32aa0828b91833ca0826f881f4a671949c9e800c91eeeed511b82e2a27384bd","schemas/truth_adapter.json":"f2904178d8ea26b43ac20258ab27a81df9189ad6e8bb886e4f1d4050cea92ea7","src/kden_r14_tabular/__init__.py":"dc521102de587e7148e0c56d4771382a917128f0a58ac3b406fc0fdc091db2ab","src/kden_r14_tabular/cli.py":"69616cfe50c8711788abf20504b183a14b1871594454d246c4a1cb2cccfbadab","src/kden_r14_tabular/common.py":"4900206e2c8fb41f0d2484a368f59b1eca5a902e77f91a93ef08c87bd0fa8a07","src/kden_r14_tabular/dates.py":"976f36d691f7d5bd2b8faf0bbb8fb914c36b4992b495ae61ec28a11685309583","src/kden_r14_tabular/foundation.py":"e83b0abf885421c88c44dc241a04e5704d5c68ed25d4f229bf74ce26e073098b","src/kden_r14_tabular/truth.py":"2fa88493fca94fe7d8847e9b60b3f69f9db11f90e5966c31da916a50b6660aa0","tests/test_foundation.py":"30b4cbb94981d63dcaf761b6d163b5b65e7c7e9c1b8486fe1ca2a8cf02bb2737"},"completed_at_utc":"2026-10-10T09:51:53.153481Z","gate_evidence":{"additional_trusted_labels":5,"development_labels":1707,"development_unresolved":3,"holdout_content_audit_performed":false,"holdout_days":365,"holdout_value_pages_read":0,"input_bindings_hashed":7260,"model_fits_performed":0,"network_requests_made":0,"runtime_isolation":{"absolute_user_paths":0,"legacy_runtime_imports":0,"source_files_scanned":6},"trusted_rows":1715},"predecessor_records":{"state/KDEN_V375_MODELING_BOUNDARY_PASS.json":"47390c33f691c5fd6635c81c9b9e609d557a4557a4dc5566da54be450c00da11","state/PREFIT_P02_PASS.json":"40ff18bbac4c927ae600fd54026671493f4e68e5e0d65cdf07374965837cf607","state/PREFIT_P06_PASS.json":"9f420b8625b428a8663d190a332a0958bf72e5565c37c4543f5b78808a7f4b72","state/PREFIT_P07_PASS.json":"f2f46becfe219f13d3d1526786d80a29c491144b64b070470f07c92bfe1ba36e","universal_issue_state/v1/manifests/p06_substrate_freeze_manifest.json":"9043b5dcb69ccfb143217ab657022f85f1750a1460e4011269526ebb08b52af6"},"record_sha256":"4d846a34f0c0a8d7d15fa1ecb9a8e939009a3c5f38fba2803dab320edf53b555","run_id":"kden-r14-t01-20261010T000000Z-foundation","schema_version":"R14_TABULAR_T01_PASS_V1","stage_id":"T01","status":"PASS"}
